行政區,主題,景點名稱,簡介,地址,門票,開放時間-一,開放時間-二,開放時間-三,開放時間-四,開放時間-五,開放時間-六,開放時間-日
大安,宗教與古蹟,殷海光故居,為地上一層之日式木造房屋，建物所使用之建材雖非上品，且規模不大，但庭院頗具規模，建築物部分外觀、室內地板、天花板、部分的門已有改建，但仍留有隔牆。代表臺北地區最早發展之都市紋理。,臺北市大安區溫州街十八巷十六弄一之一號 (龍坡里),無,全日開放,全日開放,全日開放,全日開放,全日開放,全日開放,全日開放
大安,宗教與古蹟,龍安坡黃宅濂讓居,龍安坡為清代臺北盆地東邊近山地區由福建泉州府安溪移民所開墾之地，黃氏先人於清乾隆年間來臺（西元一七四０年），初先墾居淡水蕃薯寮，後再遷居臺北盆地，至第四代由數位兄弟合力建造大宅，即濂讓居。,臺北市大安區和平東路二段七十六巷四號 (龍門里),無,全日開放,全日開放,全日開放,全日開放,全日開放,全日開放,全日開放
大安,宗教與古蹟,紫藤廬,紫藤廬即為自由主義及社會、政治改革運動的空間代名詞，為了彰顯紫藤廬的文化價值，近年經過藝文界人士及業者奔走，免去被拆之浩劫，由臺北市政府鍵定為古蹟而獲保存。,臺北市大安區新生南路三段十六巷一號 (龍坡里),無,全日開放,全日開放,全日開放,全日開放,全日開放,全日開放,全日開放
大安,宗教與古蹟,義芳居古厝,義芳居古厝為臺北早期開拓者陳氏族人所建，義芳居陳氏家族，原籍屬福建省泉州府安溪縣，清乾隆年間，其始祖渡海來臺開墾。先前他們已有住屋，至清光緒初年才投下鉅資，建造義芳居。,臺北市大安區基隆路三段一五五巷一二八號 (學府里),無,全日開放,全日開放,全日開放,全日開放,全日開放,全日開放,全日開放
大安,休閒與生態,大安森林公園,公園位於台北市區中心，是一座草木濃密的生態公園，都會森林的型態被譽為台北市的「都市之肺」；其在興建之前被稱為「七號公園」，１９９４年３月２９日正式對外開放，當時曾是台北市區最大的公園。,臺北市大安區新生南路二段1號,無,全日開放,全日開放,全日開放,全日開放,全日開放,全日開放,全日開放
大安,休閒與生態,台大農場本場,是國立臺灣大學生物資源暨農學院的附屬農場。其中場本部與農藝區位於台灣大學校總區的東南角，面積５.７７公頃，另外還有園藝區、畜牧區、安康分場，全場總面積大約３０.３７公頃。,臺北市大安區基隆路四段42巷5號,無,08:00–17:00,08:00–17:00,08:00–17:00,08:00–17:00,08:00–17:00,不開放,不開放
大安,休閒與生態,第二霧裡薜圳支流遺址,霧裡薜圳是台北盆地內最早有興建的水圳紀錄，今日，圳道幾乎已經全部予以填平荒廢，僅殘留幾小段。因其名氣遠不如?公圳，因此常被誤認。而現在在台北市區內，只能透過少數帶狀公園窺見曾經水圳的足跡。,臺北市大安區溫州街47號,無,全日開放,全日開放,全日開放,全日開放,全日開放,全日開放,全日開放
大安,休閒與生態,富陽自然生態公園,除了山形與軍事遺跡外，富陽公園最為稱道的是公園內未被破壞的生物生態。其中，自然演替區、賞蝶區、大赤鼯鼠觀察區及台北樹蛙觀察區共擁有包括香楠、相思樹、白匏子、血桐等植物，與包含樹蛙、大赤鼯鼠等多樣動物。,臺北市大安區富陽街,無,全日開放,全日開放,全日開放,全日開放,全日開放,全日開放,全日開放
大安,休閒與生態,福州山公園,位於北二高台北聯絡道、辛亥路三段旁，海拔約１０５公尺，早期是公墓，民國８４年市政府為美化市容將公墓遷走，以自然生態保育為主，廣植林木，規劃為森林生態遊憩公園。,臺北市大安區臥龍街195巷,無,全日開放,全日開放,全日開放,全日開放,全日開放,全日開放,全日開放
大安,休閒與生態,醉月湖,醉月湖，舊稱牛湳池，為調節?公圳之用，位於國立臺灣大學校本部舊體育館後方，名列該校的十二景之一。,臺北市大安區羅斯福路四段1號,無,全日開放,全日開放,全日開放,全日開放,全日開放,全日開放,全日開放
大安,商圈,公館夜市商圈,主要地標有臺北捷運公館站、臺灣大學、臺灣科技大學、臺灣師範大學公館校區（師大分部）、水源市場、台北自來水園區和台電大樓。區內羅斯福路四段一帶被稱為公館商圈，商業繁盛。,臺北市大安區羅斯福路四段90巷,無,15:00–23:45,15:00–23:45,不開放,15:00–23:45,15:00–23:45,15:00–23:45,15:00–23:45
大安,商圈,師大商圈,因位於臺灣臺北市臺灣師範大學旁而得名，是臺北南區１９９０年代興起的商圈，後一度擴張成所謂的師大夜市，旋因住宅區居民訴諸居住正義、對油煙與噪音等公害的群起抗爭，而擺脫以餐飲為主的典型夜市樣態,臺北市大安區師大路39巷,無,08:00–22:00,08:00–22:00,08:00–22:00,08:00–22:00,08:00–22:00,08:00–22:00,08:00–22:00
大安,商圈,永康商圈,在這一帶聚集了各式各樣的店家，有許多著名的台灣小吃、外省美食、異國風味餐廳、飲料冰品店、獨特風格得咖啡廳和精品商店等。,臺北市大安區永康街,無,08:00–22:00,08:00–22:00,08:00–22:00,08:00–22:00,08:00–22:00,08:00–22:00,08:00–22:00
大安,商圈,東區商圈,是台北市另一個百貨公司聚集重地，目前百貨商場有誠品敦南店（Ｅｓｌｉｔｅ Ｘｉｎｙｉ Ｓｔｏｒｅ）、太平洋ＳＯＧＯ、頂好名店城等，都成為了東區商圈的大地標。,由復興南路以東、介於市民大道和信義路中間的區域,無,全日開放,全日開放,全日開放,全日開放,全日開放,全日開放,全日開放
大安,商圈,頂好商圈,周圍的道路系統縱橫交錯、井然有序，有大型的百貨公司和許多獨特風格的精品服飾店及其他書店、速食店、ＫＴＶ，還有台灣唯一２４小時不打烊的「誠品書店」，是一個交通便利、商業活動頻繁的購物休閒場所。,臺北市大安區忠孝東路四段,無,11:00–21:30,11:00–21:30,11:00–21:30,11:00–21:30,11:00–21:30,11:00–21:30,11:00–21:30
大安,商圈,通化街夜市,臨江街夜市，前人常稱通化街夜市，是台北市的一個觀光夜市，因其範圍在通化街與基隆路間的臨江街而得名。,臺北市大安區臨江街40巷1弄,無,18:00–00:00,18:00–00:00,18:00–00:00,18:00–00:00,18:00–00:00,18:00–00:00,18:00–00:00
大安,藝文與文化,臺大藝文中心雅頌坊,建築外觀是一座教堂，具有白色外牆及彩色玻璃窗，由國立臺灣大學藝文中心使用，舉辦音樂、戲劇、舞蹈、電影、展覽等藝文表演。位於國立臺灣大學欒樹道上，附近有管理學院一號館、管理學院教研館、食品科技館。,臺北市大安區羅斯福路四段1號,無,10:00~17:00,10:00~17:00,10:00~17:00,10:00~17:00,10:00~17:00,不開放,不開放
大安,藝文與文化,青田七六,為台北帝國大學教授住宅。為適應台灣的風土氣候，擷取日式建築中適合居住的空間，再融入洋式建築的優點所形成，洋式空間包括應接室、食堂、書齋等，皆設置在外側，和式空間則在內側，雖然歷經歲月但仍不失洋式和日式融合的建築特色。,臺北市大安區青田街7巷6號,無,不開放,11:30–14:00； 14:30–17:00； 17:30–21:00,11:30–14:00； 14:30–17:00； 17:30–21:00,11:30–14:00； 14:30–17:00； 17:30–21:00,11:30–14:00； 14:30–17:00； 17:30–21:00,11:30–14:00； 14:30–17:00； 17:30–21:00,11:30–14:00； 14:30–17:00； 17:30–21:00
大安,藝文與文化,清真寺,近代臺灣最早的回教建築。當時由於我國與世界回教國家外交往來頻繁，國內回教徒期盼殷切，由外交部長葉公超先生倡議，並由回教友邦資助籌款興建，在臺北市新生南路建造了仿伊斯蘭建築式樣的禮拜堂。,臺北市大安區新生南路二段62號,無,09:00~20:00,09:00~20:00,09:00~20:00,09:00~20:00,09:00~20:00,09:00~20:00,09:00~20:00
大安,藝文與文化,禮拜文房具,提供的商品以歐洲、美國與日本的文具為主，較多是具有悠久歷史的品牌跟經典文具。,臺北市大安區樂利路72巷15號,無,不開放,12:00–21:00,12:00–21:00,12:00–21:00,12:00–21:00,12:00–21:00,12:00–21:00
大安,藝文與文化,針線盒,《針線盒》理念在於「簡單創作」，不想讓忙碌淹沒某些初衷。因為是３０年未住人的倉庫，保留原樣貌的裝潢，檜木的落地窗、木紗門、鐵花窗等散發老台北的純樸的溫度。,臺北市大安區忠孝東路三段251巷12弄10號,無,13:00–19:00,不開放,不開放,不開放,13:00–19:00,13:00–19:00,13:00–19:00
大安,藝文與文化,看到藝術,「看到藝術」以藝術家為主導，透過專業策展與論述，希望能促進ㄧ般民眾對藝術的欣賞與理解，並成為發掘藝術家與嶄新觀點的實驗場域。,臺北市大安區泰順街60巷22號,無,不開放,12:00 – 19:00,12:00 – 19:00,12:00 – 19:00,12:00 – 19:00,12:00 – 19:00,不開放
信義,宗教與古蹟,松山慈惠堂,松山慈惠堂開山郭堂主葉子女士承天命，虔誠傳道濟世，又奉瑤池金母降旨興建大型濟世道場，終尋得現址，於民國７０年正式動土，不到兩年時間興建完成。,臺北市信義區福德街251巷33號,無,06:00-22:00,06:00-22:00,06:00-22:00,06:00-22:00,06:00-22:00,06:00-22:00,06:00-22:00
信義,宗教與古蹟,松山奉天宮,松山奉天宮坐落於虎豹獅象四獸山虎山麓，毗鄰拇指、筆架諸山，緊鄰市政府、信義商圈，遠眺大屯、七星、紗帽、觀音諸山峰。居高臨下，壯觀市容、美景盡收眼底。鬧中取靜，是市民爬山休閒、沉澱心靈的好去處。,臺北市信義區福德街221巷12號,無,08:00~21:00,08:00~21:00,08:00~21:00,08:00~21:00,08:00~21:00,08:00~21:00,08:00~21:00
信義,宗教與古蹟,天寶聖道宮,是松山區和信義區兩區的信仰中心。開山為白玉城居士，廟宇的組織型態為管理人制。原主祀玉皇大帝、瑤池金母，祭典日期則是每年農曆之正月初九。,臺北市信義區松山路664之10號,無,06:30-22:30,06:30-22:30,06:30-22:30,06:30-22:30,06:30-22:30,06:30-22:30,06:30-22:30
信義,宗教與古蹟,松山進安宮,松山進安宮是本地區宗教信仰中心。鎮殿主神：五年千歲、盧府千歲、侯府千歲、薛府千歲。於民國４８年（歲次己亥年）由馬鳴山鎮安宮分靈奠基駐駕濟世。,臺北市信義區永吉路517巷8弄12-3號,無,06:30-22:30,06:30-22:30,06:30-22:30,06:30-22:30,06:30-22:30,06:30-22:30,06:30-22:30
信義,宗教與古蹟,鐵路局臺北機廠澡堂,臺北機廠日據時期原稱臺北鐵道工廠，於民國２４年(西元１９３５年)落成，以廠房佈置緊湊、設備新穎，著稱於當時，其中員工澡堂於民國８９年由台北市政府公告為直轄市古蹟，具有歷史、文化、藝術價值。,臺北市信義區市民大道五段50號,無,08:30–17:30,08:30–17:30,08:30–17:30,08:30–17:30,08:30–17:30,不開放,不開放
信義,宗教與古蹟,松山五分埔福德宮,松山五分埔福德宮建於清道光２７年，迄今已１７０年，不但是在地民眾的信仰中心，也造就了五分埔成衣商圈的繁榮經濟，至今仍是臺灣成衣批發的最大集散地。,臺北市信義區虎林街47之3號,無,全日開放,全日開放,全日開放,全日開放,全日開放,全日開放,全日開放
信義,休閒與生態,淡蘭古道,為清代時期淡水廳到噶瑪蘭廳(現今臺北到宜蘭)的主要交通道路，於１８００至１９００年期間，正是北台灣漢民族開始由西部往東部發展的黃金時期，目前多數山徑仍是登山健行者的愛好秘徑。,臺北市信義區六張犁,無,全日開放,全日開放,全日開放,全日開放,全日開放,全日開放,全日開放
信義,休閒與生態,茶路古道,此山徑為臺北至宜蘭最直線路，約不到６０公里，遇戰亂，可急行軍趕赴解危。由艋舺武營口經大安區到信義區六張犁，此段在清未年間為拳山堡、深坑一帶所種茶葉運往臺北要道，故現稱為茶路古道。,臺北市信義區六張犁,無,全日開放,全日開放,全日開放,全日開放,全日開放,全日開放,全日開放
信義,休閒與生態,木柵嶺頭古道,由信義區六張犁經石泉巖祖師廟（創建於清道光２４年）上嶺後南行土地公嶺嶺頭線（莊敬隊道上方），經嶺頭土地公廟與石軍巖廟可下木柵、景美一帶。,臺北市信義區六張犁,無,全日開放,全日開放,全日開放,全日開放,全日開放,全日開放,全日開放
信義,休閒與生態,三張犁糶米古道,由三張犁吳興街６００巷１００弄底上嶺５００崁，經糶米公廟至越嶺口，左行經樟腳可至深坑；直下經坡內坑，可抵景美溪岸。由越嶺口右行可順茶路古道下至土地公嶺木柵或下石泉巖六張犁。,臺北市信義區三張犁吳興街600巷100弄,無,全日開放,全日開放,全日開放,全日開放,全日開放,全日開放,全日開放
信義,休閒與生態,ｉ-Rｉｄｅ TＡＩPＥＩ,源自每個人對飛的渴望，那種雙腳懸空、自由翱翔於雲端上的想像，現在就由「ｉ-Ｒｉｄｅ無限飛行事務局」帶你一同展開那身歷其境的冒險。ｉ-Ｒｉｄｅ擁有最先進的體感模擬系統，以最真實的感受，體驗漫遊空中的無限魅力。,臺北市信義區松智路17號6樓,480,11：00 ~ 21：30,11：00 ~ 21：30,11：00 ~ 21：30,11：00 ~ 22：00,11：00 ~ 22：00,11：00 ~ 22：00,11：00 ~ 21：30
信義,休閒與生態,虎山親山步道,虎山是台北市民假日休閒的好去處，海拔雖只有１４０公尺，卻展望良好，經常在轉彎之處看到台北１０１。景色寬闊，生態也十分豐富，除多種蕨類外，也是孕育螢火蟲、蛙類及蜻蜓等的最佳地點，兼具郊山健行與生態觀察的特色。,臺北市信義區福德街251巷33號,無,全日開放,全日開放,全日開放,全日開放,全日開放,全日開放,全日開放
信義,商圈,信義威秀商圈,是台北精緻時尚與都會名牌的潮爆區域，購物、娛樂、休閒、美食等活動應有盡有! 為新興商業區，乃目前臺北市最具指標性的時髦都會商圈。,臺北市信義區松壽路20號,無,全日開放,全日開放,全日開放,全日開放,全日開放,全日開放,全日開放
信義,商圈,吳興商圈,台北醫學院前面以吳興街為主的商圈，白天是傳統菜市場，晚上就搖身一變成為小型夜市。,臺北市信義區吳興街,無,07:00–01:00,07:00–01:00,07:00–01:00,07:00–01:00,07:00–01:00,07:00–01:00,07:00–01:00
信義,商圈,五分埔商圈,數百家的成衣業者在此聚集，貨源來自全臺。因款式眾多、剪裁流行，不少年輕族群也前來血拼，隨個人任意搭配，創造引人目光的時尚風格。當購物慾望出現，卻預算不足或不想荷包大失血時，最適合的地方就是五分埔。,臺北市信義區永吉路443巷9弄,無,14:00–23:00,14:00–23:00,14:00–23:00,14:00–23:00,14:00–23:00,14:00–23:00,14:00–23:00
信義,商圈,香堤大道廣場,創意廣告、裝置藝術作品等，妝點得活力十足的街道。假日會有很多街頭藝人表演，百貨公司地下街都有美食街，逛街購物吃美食的好地方。,臺北市信義區松高路12號,無,全日開放,全日開放,全日開放,全日開放,全日開放,全日開放,全日開放
信義,商圈,林口街商圈,在地人下班後或假日晚上常去的夜市，白天熱鬧菜市場，晚上則做起夜市生意。 位在饒河街與通化街夜市之間，仔細尋找這裡可是潛藏許多美味好料在其中，吸引許多美食愛好的「饕」寶秘密基地！,臺北市信義區林口街40-44號,無,07:00–01:00,07:00–01:00,07:00–01:00,07:00–01:00,07:00–01:00,07:00–01:00,07:00–01:00
信義,商圈,新光三越信義新天地,１９９７年∼２００５年四館陸續開業，與威秀影城一起帶動整個信義計畫區的繁榮，該分店目前由四棟大樓組成，各館之間以天橋和地下長廊串聯，棟與棟之間有許多活動廣場，並於樓層間設有花園，是目前信義計畫區內最繁榮的百貨群。,臺北市信義區松壽路11號,無,11:00–21:30,11:00–21:30,11:00–21:30,11:00–21:30,11:00–21:30,11:00–21:30,11:00–21:30
信義,藝文與文化,松山菸廠,建於１９３７年，前身為台灣日治時期「台灣總督府專賣局松山菸草工場」，於２０１０年正式轉型定名「松山文創園區」。松山菸廠在戰後種植大量植栽，景觀優美，停產後已經成為台北市東區最大的綠地。,臺北市信義區光復南路133號,無,09:00–18:00,09:00–18:00,09:00–18:00,09:00–18:00,09:00–18:00,09:00–18:00,09:00–18:00
信義,藝文與文化,國父紀念館,位於臺北東區的綜合性文化紀念設施，係紀念中華民國國父孫中山百年誕辰而興建，於１９７２啟用，館區總面積達三萬五千坪。除了具紀念功能外，建築本體周圍則是戶外運動、休閒、藝文與知性活動的綜合性休憩公園。,臺北市信義區仁愛路四段505號,無,09:00–18:00,09:00–18:00,09:00–18:00,09:00–18:00,09:00–18:00,09:00–18:00,09:00–18:00
信義,藝文與文化,幾米月亮巴士,「幾米月亮公車」由熊熊司機領航，從「遺忘站」開往「記住站」，裡頭搭載了抱著圓月的小男孩，車廂中充滿五彩繽紛的魔法書與活潑有趣的小角色，公車後方還有一顆顆反射出週遭景象的微笑星球。,臺北市信義區信義路五段100號,無,不開放,09:00–21:00,09:00–21:00,09:00–21:00,09:00–21:00,09:00–21:00,09:00–21:00
信義,藝文與文化,臺北101,樓高５０９.２公尺，地上樓層共有１０１層、另有地下５層，曾於２００４年１２月３１日至２０１０年１月４日間擁有世界第一高樓的紀錄，世界上第一棟超過５００公尺的建築物，目前為世界第十二高樓，為臺北重要地標之一。,臺北市信義區信義路五段7號,無,11:00~21:30,11:00~21:30,11:00~21:30,11:00~21:30,11:00~22:00,11:00~22:00,11:00~21:30
信義,藝文與文化,台北探索館,昔日為「市政資料館」。它除了在探尋台北市歷史文化的軌跡，了解現今台北的人文、社會及各項藝文生活資源外，另外也在使民眾了解台北市的重大公共建設發展及與國際交流互動的情形。目前位於台北市市政大樓門廳右側。,臺北市信義區市府路1號,無,不開放,09:00–17:00,09:00–17:00,09:00–17:00,09:00–17:00,09:00–17:00,09:00–17:00
信義,藝文與文化,四四南村,為台北市第一個眷村，由於位在陸軍庫房聯勤第四十四兵工廠的南邊因而命名。直自１９９９年，將代表性的部分房舍更改建成「信義公民會館」，包含特展館、眷村展示館、展演館、社區館、四四廣場及文化公園等多元化展覽用途。,臺北市信義區信義路五段24巷5弄24號,無,9:00∼16:00,9:00∼16:00,9:00∼16:00,9:00∼16:00,9:00∼16:00,9:00∼16:00,9:00∼16:00
南港,宗教與古蹟,松山療養所所長宿舍,本建物為日據時期松山療養所所長官舍，創建年代約１９３６年，所在區域原為防癆病院區宿舍區，建物內部都是原物，相當難得。,臺北市南港區昆陽街164號,無,全日開放,全日開放,全日開放,全日開放,全日開放,全日開放,全日開放
南港,宗教與古蹟,南港煙囪,南港煙囪創建年代約於西元１９５９年，煙囪經多次修改，結構不佳，位於南港輪胎股份有限公司南港廠內鍋爐室，可見證臺北黑鄉與南港地區的發展,臺北市南港區南港路二段51號,無,全日開放,全日開放,全日開放,全日開放,全日開放,全日開放,全日開放
南港,宗教與古蹟,南港瓶蓋工廠,１９４３年由日人設立的「國產軟木工業株式會社」，臺灣光復後由今臺灣菸酒股份有限公司接管並先後改名為「木栓工廠」及「臺灣省菸酒公賣局瓶蓋工廠」，專門生產公賣局所屬１４家酒廠酒類包裝所需各種瓶蓋、軟木栓等產品。,臺北市南港區南港路2段13號,無,不開放,不開放,不開放,不開放,不開放,不開放,不開放
南港,宗教與古蹟,港仔口老街,三重埔靠近基隆河與大坑溪會流的地方，叫「港仔口」，是三重埔最早開發的地區，也是南港河運的起點。,臺北市南港區南港路一段10巷,無,全日開放,全日開放,全日開放,全日開放,全日開放,全日開放,全日開放
南港,宗教與古蹟,闕家古厝,世居南港的闕家，人丁旺盛，闕家古厝為三合院，正廳頂上鋪稻草，每兩年換一次。宅院建有二樓閣房，有瞭望守衛之功能。闕家老者口述：此大厝地理風水為牛穴，山為牛神，大廳頂鋪稻草及前端池塘，均有供牛飲食之意。,臺北市南港區研究院路一段120號,無,全日開放，族人居住，注意禮儀,全日開放，族人居住，注意禮儀,全日開放，族人居住，注意禮儀,全日開放，族人居住，注意禮儀,全日開放，族人居住，注意禮儀,全日開放，族人居住，注意禮儀,全日開放，族人居住，注意禮儀
南港,宗教與古蹟,畚箕湖余家古厝,完整土埆厝三合院，現今十分罕見。二百年前先祖由安溪來台，百年前曾因陳秋菊抗日，民軍於附近襲殺一日本巡查，報復燒莊波及重建後保持至今。屋外有胸圍２７０公分的老樟樹在入口處，日治時曾被樟腦專賣會社列入砍伐，余家私賄倖存下來。,臺北市南港區舊莊路二段316巷5號,無,全日開放,全日開放,全日開放,全日開放,全日開放,全日開放,全日開放
南港,休閒與生態,南港茶葉製造示範場,示範場內部設有製茶機械展示教學室、茶文物特展室、茶葉評鑑區、茶葉活動實習教學區等，帶領民眾認識茶葉製作過程、見證南港茶葉興盛歷史，同時還能親自動手泡茶，學習沖泡、品嘗最具風味的南港包種茶。,臺北市南港區舊莊街二段336號,150,10:00 – 17:00,10:00 – 17:00,10:00 – 17:00,10:00 – 17:00,10:00 – 17:00,10:00 – 17:00,10:00 – 17:00
南港,休閒與生態,椿萱農場,原名南港第一市民農場的椿萱農場，轉型為兼具教育與休閒功能的綜合性農園，園區內種植一千多株的香椿樹、金針花及桂花樹，同時設有樹屋和觀景台供民眾優遊賞景。,臺北市南港區舊莊街二段122巷11號,無,09:00 – 17:00,09:00 – 17:00,09:00 – 17:00,09:00 – 17:00,09:00 – 17:00,09:00 – 17:00,09:00 – 17:00
南港,休閒與生態,大坑溪桂花吊橋親水步道,桂花在南港茶山的栽培歷史和包種茶一樣久，因為最早它是製作香片花茶的附香材料。桂花吊橋是南港山的秘密花園，小橋流水、精緻迷你，是平穩且乾淨的步道，兩者總長不到一公里，可居高遠眺臺北盆地，能見識南港當地特色植物與煤礦露層。,臺北市南港區舊莊街二段334號,無,全日開放,全日開放,全日開放,全日開放,全日開放,全日開放,全日開放
南港,休閒與生態,環山棧道,可居高遠眺臺北盆地，還能見識南港當地特色植物與煤礦露層,臺北市南港區舊莊街二段336號,無,全日開放,全日開放,全日開放,全日開放,全日開放,全日開放,全日開放
南港,休閒與生態,南港觀光茶園,海拔２００至３００公尺，土壤富含岩礫，雨量適中，適合茶樹生長，是百餘年前南港包種茶的發源地。然而，隨著戰爭與煤礦產業興起，茶園大量減少，民國７１年設置觀光茶園，加上當地青年的大力推廣，才重新找回昔日風光。,臺北市南港區舊莊街二段,無,全日開放,全日開放,全日開放,全日開放,全日開放,全日開放,全日開放
南港,休閒與生態,十八羅漢洞,"質地堅硬，經侵蝕風化後，形成數個巨大石塊，好似十八個羅漢。從前洞內聚集成千上萬的蝙蝠，又稱為""密婆洞""。民國７４年有老師父修行故而封洞，勝地內有一座台北市僅存的木板吊橋，全長５０公尺，橋名「舜若多橋」。",臺北市南港區研究院路三段,無,全日開放,全日開放,全日開放,全日開放,全日開放,全日開放,全日開放
南港,休閒與生態,南港山系-更寮古道親山步道,更寮古道親山步道是早年南港通往深坑和石碇的五條古道中，保存最完整且仍使用的古道。現今已鋪上花崗石步階，然而起訖狹窄的路況，仍顯現古老粗獷的原始味。更寮古道後段與栳寮古道銜接，曾經是運送、製造樟腦的場區，舊名就叫腦寮古道。,臺北市南港區舊莊街二段122巷,無,全日開放,全日開放,全日開放,全日開放,全日開放,全日開放,全日開放
